{
  "schemaVersion": 1,
  "id": "candidate-2026-07-23",
  "generatedAt": "2026-07-23T22:55:00Z",
  "source": {
    "repository": "pawnkit/pawn-actions",
    "commit": "a9309beb4e07fceb619232633c3eb08c4249ac16"
  },
  "targets": ["linux-amd64", "windows-amd64", "darwin-arm64"],
  "profiles": ["samp-037", "openmp"],
  "components": [
    {
      "name": "pawn",
      "repository": "pawnkit/pawnkit-cli",
      "version": "v1.1.3",
      "commit": "b00731e222c5f74d7f2808ae6a842ff37f9c9315",
      "artifacts": [
        {
          "target": "linux-amd64",
          "url": "https://github.com/pawnkit/pawnkit-cli/releases/download/v1.1.3/pawn-linux-amd64.tar.gz",
          "size": 3212419,
          "checksum": "sha256:573407a0ec7adda5fa74c0afeda162170c3a98530270f71f2cf31e2ea968df55"
        },
        {
          "target": "windows-amd64",
          "url": "https://github.com/pawnkit/pawnkit-cli/releases/download/v1.1.3/pawn-windows-amd64.tar.gz",
          "size": 3294828,
          "checksum": "sha256:19baf567bc1933b40b3b1ebbf811d3b9deb95febbc0deb9f6ffed9bc0e9547fb"
        },
        {
          "target": "darwin-arm64",
          "url": "https://github.com/pawnkit/pawnkit-cli/releases/download/v1.1.3/pawn-darwin-arm64.tar.gz",
          "size": 2975810,
          "checksum": "sha256:e12a10d2e91e5f60605ca947754b25e0c9cb8c837702e79ad1ee861529823d82"
        }
      ]
    },
    {
      "name": "pawnfmt",
      "repository": "pawnkit/pawnfmt",
      "version": "v1.3.5",
      "commit": "54bfb8aac65e27b70fbfcc13914d93658b5db2de",
      "artifacts": [
        {
          "target": "linux-amd64",
          "url": "https://github.com/pawnkit/pawnfmt/releases/download/v1.3.5/pawnfmt_1.3.5_linux_amd64.tar.gz",
          "size": 2366183,
          "checksum": "sha256:4374c1b48d1d212cd8d760bd30c1daadee31a36f55b4b5524383b3318de9d4a7"
        },
        {
          "target": "windows-amd64",
          "url": "https://github.com/pawnkit/pawnfmt/releases/download/v1.3.5/pawnfmt_1.3.5_windows_amd64.zip",
          "size": 2432065,
          "checksum": "sha256:91a11084c1bfcf47adc50df05966d5bdb072c644636275153dcc3cfc4d6877fc"
        },
        {
          "target": "darwin-arm64",
          "url": "https://github.com/pawnkit/pawnfmt/releases/download/v1.3.5/pawnfmt_1.3.5_darwin_arm64.tar.gz",
          "size": 2183044,
          "checksum": "sha256:44819902c67b6e52e2b1b3ab5c0a0310b2baf7f9189f89b42b3137f1dcb1ce6e"
        }
      ]
    },
    {
      "name": "pawnlint",
      "repository": "pawnkit/pawnlint",
      "version": "v1.1.4",
      "commit": "1ef0f687fd30a7914af97854e3689ca8f91392b4",
      "artifacts": [
        {
          "target": "linux-amd64",
          "url": "https://github.com/pawnkit/pawnlint/releases/download/v1.1.4/pawnlint_1.1.4_linux_amd64.tar.gz",
          "size": 3667676,
          "checksum": "sha256:55c08f79e5805ae176ba195b6994b36902f143cee302fe381feebce91a54e4b1"
        },
        {
          "target": "windows-amd64",
          "url": "https://github.com/pawnkit/pawnlint/releases/download/v1.1.4/pawnlint_1.1.4_windows_amd64.zip",
          "size": 3752890,
          "checksum": "sha256:29466f46db85b35353fab2ee9964e4e6c7d3f1158548b56a45f9e86b0a988a2b"
        },
        {
          "target": "darwin-arm64",
          "url": "https://github.com/pawnkit/pawnlint/releases/download/v1.1.4/pawnlint_1.1.4_darwin_arm64.tar.gz",
          "size": 3395707,
          "checksum": "sha256:e7d5f6fd2c2a99888ef9590c18660e3ae47f99736a58a33022a30ad394fe4c58"
        }
      ]
    },
    {
      "name": "pawnlsp",
      "repository": "pawnkit/pawnlsp",
      "version": "v0.26.2",
      "commit": "7fb38fd06d2a76b5c51ebd30a41ca0a56e0509a4",
      "artifacts": [
        {
          "target": "linux-amd64",
          "url": "https://github.com/pawnkit/pawnlsp/releases/download/v0.26.2/pawnlsp_0.26.2_linux_amd64.tar.gz",
          "size": 3102283,
          "checksum": "sha256:1485de7752ab5848474a9bcace6b47739450d5ce7ca50c738460dc94618c36df"
        },
        {
          "target": "windows-amd64",
          "url": "https://github.com/pawnkit/pawnlsp/releases/download/v0.26.2/pawnlsp_0.26.2_windows_amd64.zip",
          "size": 3176830,
          "checksum": "sha256:c51f6214cad1d37e77ad0a7dc77a3c9f78e8f777946a680f25da81b88c420f8a"
        },
        {
          "target": "darwin-arm64",
          "url": "https://github.com/pawnkit/pawnlsp/releases/download/v0.26.2/pawnlsp_0.26.2_darwin_arm64.tar.gz",
          "size": 2900696,
          "checksum": "sha256:0fe3c8ed1e72f16f20ac368ca463060bd6bcc1353fa101167d3adf3d28f2c2d0"
        }
      ]
    },
    {
      "name": "pawntest",
      "repository": "pawnkit/pawntest",
      "version": "v1.1.4",
      "commit": "504adee68aa9f87175e357b464158a95fa9667c7",
      "artifacts": [
        {
          "target": "linux-amd64",
          "url": "https://github.com/pawnkit/pawntest/releases/download/v1.1.4/pawntest_1.1.4_linux_amd64.tar.gz",
          "size": 6104202,
          "checksum": "sha256:ddad53e66bc723ce2db24d3415afd49bb39d61d9127f821f15841559e4c122ab"
        },
        {
          "target": "windows-amd64",
          "url": "https://github.com/pawnkit/pawntest/releases/download/v1.1.4/pawntest_1.1.4_windows_amd64.zip",
          "size": 6253542,
          "checksum": "sha256:8e4531941fc99ef377965154981724a4b8c6d4966d0c67e295e4795629a08fda"
        },
        {
          "target": "darwin-arm64",
          "url": "https://github.com/pawnkit/pawntest/releases/download/v1.1.4/pawntest_1.1.4_darwin_arm64.tar.gz",
          "size": 5855088,
          "checksum": "sha256:79a0b4f67195d5084fd6453cba3052f06dd1faee31cca8e0b9d8547b56d0815d"
        }
      ]
    }
  ],
  "schemas": [
    {
      "name": "pawn-project",
      "version": 1,
      "url": "https://schemas.pawnkit.dev/pawn-project/v1/schema.json",
      "checksum": "sha256:b9c15d88bf3d6c4b30079ac88247714c3370281e3cca812c37dd537e25840905"
    },
    {
      "name": "pawn-release-set",
      "version": 1,
      "url": "https://schemas.pawnkit.dev/pawn-release-set/v1/schema.json",
      "checksum": "sha256:4f15c7092149abaa9373df0a6ea6b1c6bc845b77fb8d441ba0a10cc9e71fa8a1"
    }
  ],
  "evidence": {
    "workflow": "https://github.com/pawnkit/pawn-actions/actions/runs/30051241791",
    "commit": "a9309beb4e07fceb619232633c3eb08c4249ac16",
    "completedAt": "2026-07-23T22:51:37Z",
    "projects": [
      "pawn-corpus/projects/minimal-samp-gamemode",
      "pawn-corpus/projects/filterscript-with-includes"
    ],
    "targets": ["linux-amd64", "windows-amd64", "darwin-arm64"]
  },
  "knownLimits": [
    "This is a bootstrap candidate. Its full cross-tool smoke test has not run.",
    "Build, test, and run still need configured compilers and runtime providers.",
    "Native plugin execution and debugging remain experimental."
  ]
}
