{
  "schemaVersion": 1,
  "id": "build-preview-2026-07-24",
  "generatedAt": "2026-07-24T00:05:22Z",
  "source": {
    "repository": "pawnkit/pawn-actions",
    "commit": "548948a786b47184aa4fff8ef6a64e71353fabda"
  },
  "targets": [
    "linux-amd64",
    "windows-amd64",
    "darwin-arm64"
  ],
  "profiles": [
    "samp-037",
    "openmp"
  ],
  "components": [
    {
      "name": "pawn",
      "repository": "pawnkit/pawnkit-cli",
      "version": "v1.2.0",
      "commit": "f4ad27a5031c4454b605dda0218032df46d608a3",
      "artifacts": [
        {
          "target": "linux-amd64",
          "url": "https://github.com/pawnkit/pawnkit-cli/releases/download/v1.2.0/pawn-linux-amd64.tar.gz",
          "size": 3236217,
          "checksum": "sha256:530b6da4c697a3dbc8d19498ea730025191f667b0af4d390ac20d98e263e8e5a"
        },
        {
          "target": "windows-amd64",
          "url": "https://github.com/pawnkit/pawnkit-cli/releases/download/v1.2.0/pawn-windows-amd64.tar.gz",
          "size": 3322067,
          "checksum": "sha256:7d0cf31c6542a25ba16d3725ab8d1cb7f3a85a948031153626a12765198ebffc"
        },
        {
          "target": "darwin-arm64",
          "url": "https://github.com/pawnkit/pawnkit-cli/releases/download/v1.2.0/pawn-darwin-arm64.tar.gz",
          "size": 2999811,
          "checksum": "sha256:e959351871a1cd555ccecb7f81f7ecc033c55b071871ff7ce6c9446fce7bbac7"
        }
      ]
    },
    {
      "name": "pawnfmt",
      "repository": "pawnkit/pawnfmt",
      "version": "v1.3.5",
      "commit": "54bfb8aac65e27b70fbfcc13914d93658b5db2de",
      "artifacts": [
        {
          "target": "linux-amd64",
          "url": "https://github.com/pawnkit/pawnfmt/releases/download/v1.3.5/pawnfmt_1.3.5_linux_amd64.tar.gz",
          "size": 2366183,
          "checksum": "sha256:4374c1b48d1d212cd8d760bd30c1daadee31a36f55b4b5524383b3318de9d4a7"
        },
        {
          "target": "windows-amd64",
          "url": "https://github.com/pawnkit/pawnfmt/releases/download/v1.3.5/pawnfmt_1.3.5_windows_amd64.zip",
          "size": 2432065,
          "checksum": "sha256:91a11084c1bfcf47adc50df05966d5bdb072c644636275153dcc3cfc4d6877fc"
        },
        {
          "target": "darwin-arm64",
          "url": "https://github.com/pawnkit/pawnfmt/releases/download/v1.3.5/pawnfmt_1.3.5_darwin_arm64.tar.gz",
          "size": 2183044,
          "checksum": "sha256:44819902c67b6e52e2b1b3ab5c0a0310b2baf7f9189f89b42b3137f1dcb1ce6e"
        }
      ]
    },
    {
      "name": "pawnlint",
      "repository": "pawnkit/pawnlint",
      "version": "v1.1.4",
      "commit": "1ef0f687fd30a7914af97854e3689ca8f91392b4",
      "artifacts": [
        {
          "target": "linux-amd64",
          "url": "https://github.com/pawnkit/pawnlint/releases/download/v1.1.4/pawnlint_1.1.4_linux_amd64.tar.gz",
          "size": 3667676,
          "checksum": "sha256:55c08f79e5805ae176ba195b6994b36902f143cee302fe381feebce91a54e4b1"
        },
        {
          "target": "windows-amd64",
          "url": "https://github.com/pawnkit/pawnlint/releases/download/v1.1.4/pawnlint_1.1.4_windows_amd64.zip",
          "size": 3752890,
          "checksum": "sha256:29466f46db85b35353fab2ee9964e4e6c7d3f1158548b56a45f9e86b0a988a2b"
        },
        {
          "target": "darwin-arm64",
          "url": "https://github.com/pawnkit/pawnlint/releases/download/v1.1.4/pawnlint_1.1.4_darwin_arm64.tar.gz",
          "size": 3395707,
          "checksum": "sha256:e7d5f6fd2c2a99888ef9590c18660e3ae47f99736a58a33022a30ad394fe4c58"
        }
      ]
    },
    {
      "name": "pawnlsp",
      "repository": "pawnkit/pawnlsp",
      "version": "v0.26.2",
      "commit": "7fb38fd06d2a76b5c51ebd30a41ca0a56e0509a4",
      "artifacts": [
        {
          "target": "linux-amd64",
          "url": "https://github.com/pawnkit/pawnlsp/releases/download/v0.26.2/pawnlsp_0.26.2_linux_amd64.tar.gz",
          "size": 3102283,
          "checksum": "sha256:1485de7752ab5848474a9bcace6b47739450d5ce7ca50c738460dc94618c36df"
        },
        {
          "target": "windows-amd64",
          "url": "https://github.com/pawnkit/pawnlsp/releases/download/v0.26.2/pawnlsp_0.26.2_windows_amd64.zip",
          "size": 3176830,
          "checksum": "sha256:c51f6214cad1d37e77ad0a7dc77a3c9f78e8f777946a680f25da81b88c420f8a"
        },
        {
          "target": "darwin-arm64",
          "url": "https://github.com/pawnkit/pawnlsp/releases/download/v0.26.2/pawnlsp_0.26.2_darwin_arm64.tar.gz",
          "size": 2900696,
          "checksum": "sha256:0fe3c8ed1e72f16f20ac368ca463060bd6bcc1353fa101167d3adf3d28f2c2d0"
        }
      ]
    },
    {
      "name": "pawntest",
      "repository": "pawnkit/pawntest",
      "version": "v1.1.4",
      "commit": "504adee68aa9f87175e357b464158a95fa9667c7",
      "artifacts": [
        {
          "target": "linux-amd64",
          "url": "https://github.com/pawnkit/pawntest/releases/download/v1.1.4/pawntest_1.1.4_linux_amd64.tar.gz",
          "size": 6104202,
          "checksum": "sha256:ddad53e66bc723ce2db24d3415afd49bb39d61d9127f821f15841559e4c122ab"
        },
        {
          "target": "windows-amd64",
          "url": "https://github.com/pawnkit/pawntest/releases/download/v1.1.4/pawntest_1.1.4_windows_amd64.zip",
          "size": 6253542,
          "checksum": "sha256:8e4531941fc99ef377965154981724a4b8c6d4966d0c67e295e4795629a08fda"
        },
        {
          "target": "darwin-arm64",
          "url": "https://github.com/pawnkit/pawntest/releases/download/v1.1.4/pawntest_1.1.4_darwin_arm64.tar.gz",
          "size": 5855088,
          "checksum": "sha256:79a0b4f67195d5084fd6453cba3052f06dd1faee31cca8e0b9d8547b56d0815d"
        }
      ]
    }
  ],
  "schemas": [
    {
      "name": "pawn-project",
      "version": 1,
      "url": "https://schemas.pawnkit.dev/pawn-project/v1/schema.json",
      "checksum": "sha256:b9c15d88bf3d6c4b30079ac88247714c3370281e3cca812c37dd537e25840905"
    },
    {
      "name": "pawn-release-set",
      "version": 1,
      "url": "https://schemas.pawnkit.dev/pawn-release-set/v1/schema.json",
      "checksum": "sha256:4f15c7092149abaa9373df0a6ea6b1c6bc845b77fb8d441ba0a10cc9e71fa8a1"
    },
    {
      "name": "pawn-build-backend",
      "version": 1,
      "url": "https://schemas.pawnkit.dev/pawn-build-backend/v1/schema.json",
      "checksum": "sha256:c6a693568859dc3a84fac2f4ac5d5e9ad2b2ae04a2b737d7c17a1f5a15564e04"
    }
  ],
  "evidence": {
    "workflow": "https://github.com/pawnkit/pawn-actions/actions/runs/30055062367",
    "commit": "548948a786b47184aa4fff8ef6a64e71353fabda",
    "completedAt": "2026-07-24T00:05:22Z",
    "projects": [
      "pawn-corpus/projects/minimal-samp-gamemode",
      "pawn-corpus/projects/filterscript-with-includes"
    ],
    "targets": [
      "linux-amd64",
      "windows-amd64",
      "darwin-arm64"
    ]
  },
  "knownLimits": [
    "The LSP is checked for installation and version output, not protocol behavior.",
    "Format and lint run standalone; the CLI checks project discovery and lint.",
    "Direct compiler builds are checked on Linux with Pawn 3.10.10.",
    "External build backends, sampctl, test, and run still need integration evidence.",
    "Native plugin execution and debugging remain experimental."
  ]
}
